<?xml version="1.0" encoding="UTF-8"?>
<specdocument
    xmlns="https://github.com/itsallcode/doc/aspec.xsd"
    xmlns:xsi="http://www.w3.org/2001/XMLSchema-instance"
    xsi:schemaLocation="https://github.com/itsallcode/doc/aspec.xsd aspec.xsd">
  <specobjects doctype="impl">
    <specobject>
      <id>exampleA-862136883</id>
      <version>0</version>
      <status>approved</status>
      <sourcefile>/home/poldi/Project/openfasttrace-gradle/example-projects/custom-config/repository/requirements-0.1.zip!source.java</sourcefile>
      <sourceline>1</sourceline>
      <coverage>
        <shallowCoverageStatus>COVERED</shallowCoverageStatus>
        <deepCoverageStatus>COVERED</deepCoverageStatus>
        <coveringSpecObjects></coveringSpecObjects>
      </coverage>
      <covering>
        <coveredType>
          <id>exampleA</id>
          <version>1</version>
          <doctype>dsn</doctype>
        </coveredType>
      </covering>
    </specobject>
    <specobject>
      <id>impl-accepted</id>
      <version>1</version>
      <shortdesc>Impl requirements</shortdesc>
      <status>approved</status>
      <sourcefile>/home/poldi/Project/openfasttrace-gradle/example-projects/custom-config/custom-dir/spec.md</sourcefile>
      <sourceline>74</sourceline>
      <description>This impl is valid.</description>
      <coverage>
        <shallowCoverageStatus>COVERED</shallowCoverageStatus>
        <deepCoverageStatus>COVERED</deepCoverageStatus>
        <coveringSpecObjects></coveringSpecObjects>
      </coverage>
      <covering>
        <coveredType>
          <id>dsn-covered</id>
          <version>1</version>
          <doctype>dsn</doctype>
        </coveredType>
      </covering>
    </specobject>
    <specobject>
      <id>impl-wrong-dsn-version</id>
      <version>1</version>
      <status>approved</status>
      <sourcefile>/home/poldi/Project/openfasttrace-gradle/example-projects/custom-config/custom-dir/spec.md</sourcefile>
      <sourceline>83</sourceline>
      <description>This impl reference a dsn requirement but uses a wrong version.</description>
      <coverage>
        <shallowCoverageStatus>COVERED</shallowCoverageStatus>
        <deepCoverageStatus>COVERED</deepCoverageStatus>
        <coveringSpecObjects></coveringSpecObjects>
      </coverage>
      <covering>
        <coveredType>
          <id>dsn-uncovered-impl-wrong-version</id>
          <version>2</version>
          <doctype>dsn</doctype>
        </coveredType>
        <coveredType>
          <id>dsn-uncovered-impl-wrong-version</id>
          <version>1</version>
          <doctype>dsn</doctype>
        </coveredType>
      </covering>
    </specobject>
    <specobject>
      <id>impl-wrong-status</id>
      <version>1</version>
      <status>proposed</status>
      <sourcefile>/home/poldi/Project/openfasttrace-gradle/example-projects/custom-config/custom-dir/spec.md</sourcefile>
      <sourceline>92</sourceline>
      <description>This impl has a non approved status.</description>
      <coverage>
        <shallowCoverageStatus>UNCOVERED</shallowCoverageStatus>
        <deepCoverageStatus>UNCOVERED</deepCoverageStatus>
        <coveringSpecObjects></coveringSpecObjects>
      </coverage>
      <covering>
        <coveredType>
          <id>dsn-uncovered-impl-only-proposed</id>
          <version>1</version>
          <doctype>dsn</doctype>
        </coveredType>
      </covering>
    </specobject>
    <specobject>
      <id>impl-duplicate1</id>
      <version>1</version>
      <status>approved</status>
      <sourcefile>/home/poldi/Project/openfasttrace-gradle/example-projects/custom-config/custom-dir/spec.md</sourcefile>
      <sourceline>102</sourceline>
      <description>This impl is duplicate.</description>
      <coverage>
        <shallowCoverageStatus>COVERED</shallowCoverageStatus>
        <deepCoverageStatus>COVERED</deepCoverageStatus>
        <coveringSpecObjects></coveringSpecObjects>
      </coverage>
      <covering>
        <coveredType>
          <id>dsn-covered-impl-duplicates</id>
          <version>1</version>
          <doctype>dsn</doctype>
        </coveredType>
      </covering>
    </specobject>
    <specobject>
      <id>impl-duplicate</id>
      <version>1</version>
      <status>approved</status>
      <sourcefile>/home/poldi/Project/openfasttrace-gradle/example-projects/custom-config/custom-dir/spec.md</sourcefile>
      <sourceline>111</sourceline>
      <description>This impl is duplicate.</description>
      <coverage>
        <shallowCoverageStatus>COVERED</shallowCoverageStatus>
        <deepCoverageStatus>COVERED</deepCoverageStatus>
        <coveringSpecObjects></coveringSpecObjects>
      </coverage>
      <covering>
        <coveredType>
          <id>dsn-covered-impl-duplicates2</id>
          <version>1</version>
          <doctype>dsn</doctype>
        </coveredType>
      </covering>
    </specobject>
    <specobject>
      <id>impl-accepted-plus-unexpected</id>
      <version>1</version>
      <status>approved</status>
      <sourcefile>/home/poldi/Project/openfasttrace-gradle/example-projects/custom-config/custom-dir/spec.md</sourcefile>
      <sourceline>120</sourceline>
      <description>This impl is valid.</description>
      <coverage>
        <shallowCoverageStatus>COVERED</shallowCoverageStatus>
        <deepCoverageStatus>COVERED</deepCoverageStatus>
        <coveringSpecObjects></coveringSpecObjects>
      </coverage>
      <covering>
        <coveredType>
          <id>dsn-covered-superflous-itest</id>
          <version>1</version>
          <doctype>dsn</doctype>
        </coveredType>
      </covering>
    </specobject>
    <specobject>
      <id>dsn-covered-impl-duplicates-1646098659</id>
      <version>0</version>
      <status>approved</status>
      <sourcefile>/home/poldi/Project/openfasttrace-gradle/example-projects/custom-config/custom-dir/source.java</sourcefile>
      <sourceline>1</sourceline>
      <coverage>
        <shallowCoverageStatus>COVERED</shallowCoverageStatus>
        <deepCoverageStatus>COVERED</deepCoverageStatus>
        <coveringSpecObjects></coveringSpecObjects>
      </coverage>
      <covering>
        <coveredType>
          <id>dsn-covered-impl-duplicates</id>
          <version>1</version>
          <doctype>dsn</doctype>
        </coveredType>
      </covering>
    </specobject>
  </specobjects>
  <specobjects doctype="arch">
    <specobject>
      <id>arch-covered</id>
      <version>1</version>
      <shortdesc>Arch Requirements</shortdesc>
      <status>approved</status>
      <sourcefile>/home/poldi/Project/openfasttrace-gradle/example-projects/custom-config/repository/requirements-0.1.zip!spec.md</sourcefile>
      <sourceline>12</sourceline>
      <description>Valid Arch Requirement.</description>
      <coverage>
        <needscoverage>
          <needsobj>dsn</needsobj>
        </needscoverage>
        <shallowCoverageStatus>COVERED</shallowCoverageStatus>
        <deepCoverageStatus>COVERED</deepCoverageStatus>
        <coveringSpecObjects>
          <coveringSpecObject>
            <id>dsn-covered</id>
            <version>1</version>
            <doctype>dsn</doctype>
            <status>approved</status>
            <ownCoverageStatus>COVERED</ownCoverageStatus>
            <deepCoverageStatus>COVERED</deepCoverageStatus>
            <coveringStatus>COVERING</coveringStatus>
          </coveringSpecObject>
        </coveringSpecObjects>
        <coveredTypes>
          <coveredType>dsn</coveredType>
        </coveredTypes>
      </coverage>
    </specobject>
    <specobject>
      <id>arch-impl-only-proposed</id>
      <version>1</version>
      <status>approved</status>
      <sourcefile>/home/poldi/Project/openfasttrace-gradle/example-projects/custom-config/repository/requirements-0.1.zip!spec.md</sourcefile>
      <sourceline>19</sourceline>
      <description>Valid Arch Requirement.</description>
      <coverage>
        <needscoverage>
          <needsobj>dsn</needsobj>
        </needscoverage>
        <shallowCoverageStatus>COVERED</shallowCoverageStatus>
        <deepCoverageStatus>UNCOVERED</deepCoverageStatus>
        <coveringSpecObjects>
          <coveringSpecObject>
            <id>dsn-uncovered-impl-only-proposed</id>
            <version>1</version>
            <doctype>dsn</doctype>
            <status>approved</status>
            <ownCoverageStatus>UNCOVERED</ownCoverageStatus>
            <deepCoverageStatus>UNCOVERED</deepCoverageStatus>
            <coveringStatus>UNCOVERED</coveringStatus>
          </coveringSpecObject>
        </coveringSpecObjects>
        <coveredTypes>
          <coveredType>dsn</coveredType>
        </coveredTypes>
      </coverage>
    </specobject>
    <specobject>
      <id>arch-impl-duplicates</id>
      <version>1</version>
      <status>approved</status>
      <sourcefile>/home/poldi/Project/openfasttrace-gradle/example-projects/custom-config/repository/requirements-0.1.zip!spec.md</sourcefile>
      <sourceline>26</sourceline>
      <description>Valid Arch Requirement.</description>
      <coverage>
        <needscoverage>
          <needsobj>dsn</needsobj>
        </needscoverage>
        <shallowCoverageStatus>COVERED</shallowCoverageStatus>
        <deepCoverageStatus>COVERED</deepCoverageStatus>
        <coveringSpecObjects>
          <coveringSpecObject>
            <id>dsn-covered-impl-duplicates</id>
            <version>1</version>
            <doctype>dsn</doctype>
            <status>approved</status>
            <ownCoverageStatus>COVERED</ownCoverageStatus>
            <deepCoverageStatus>COVERED</deepCoverageStatus>
            <coveringStatus>COVERING</coveringStatus>
          </coveringSpecObject>
        </coveringSpecObjects>
        <coveredTypes>
          <coveredType>dsn</coveredType>
        </coveredTypes>
      </coverage>
    </specobject>
    <specobject>
      <id>arch-impl-wrong-version</id>
      <version>1</version>
      <status>approved</status>